titleno,title_sum
2,半導體教授執掌南韓半導體發展大旗 李宗昊曾與三星打FinFET官司南韓國立首爾大學半導體共同研究所長李宗昊，被提名為下一任科學技術ICT部長。李宗昊為半導體FinFET專家，獲得提名顯示南韓尹錫悅新任政府，將更積極強化半導體產業的研發及人才培育。
3,IC通路B2B代理權吃香 匯率走貶獲利有撐近期消費電子產品受到通膨、零組件庫存偏高等影響，終端銷售力道持續傳出減弱雜音，不過在商用B2B、工控、車用等領域，基礎IC仍供不應求，不少國際IDM大廠的中高階微控制器(MCU)、類比晶片等平均交期仍普遍在30~52週。對於台系IC通路業者來說，掌握B2B晶片代理權的業者，第1季仍繳出亮眼業績表現，與此同時，新台幣匯率走貶，也有利於通路業者獲利表現。
4,力積電毛利率衝破5成  2022產能依舊滿載晶圓代工大廠力積電面對持續逾1年的代工報價漲勢將終止雜音，總經理謝再居坦言，成熟製程確實目前應該已漲到一定程度，2021年中已與客戶簽訂長約，所以沒辦法再有進一步漲價，目前價格會維持一段時間，下半年會有小的產能擴充計畫，目前產能依舊滿載，對於全年營收表現審慎樂觀。
5,聯發科1Q22成績穩健 AIoT產品線成長動能看俏雖然手機市場雜音不斷，聯發科2022年首季營收表現仍然亮眼，AIoT產品線出貨動能強勁，PMIC及ASIC應用的業務也穩定成長，奠下強健的成長基礎。面對更具挑戰的第2季，能否在中國手機市場最為低迷的時刻維持出貨表現，也備受考驗。
6,類比IC漲價放緩吃緊依舊 8吋新產能開出進度慢雖然全球經濟陷入高度不確定性，但類比IC供需狀況仍然相對吃緊，國際IDM大廠的產品交期持續拉長，價格也跟著上漲。台系IC設計業者坦言，雖然類比IC對於晶圓的急迫程度沒有像2021年那麼誇張，但整體來說，訂單需求還是大於可取得的產能，主因是8吋晶圓遲遲沒有新產能開出，且家電產品都在推進數位化，對類比IC的需求規模只會愈來愈高。
7,驅動IC首季營收亮眼 2Q將面臨真正考驗台系顯示驅動IC(DDI)業者陸續公布3月營收成績，整體來看，多數DDI業者第1季營收還是不錯，仍維持與2021年下半相當的營收規模，年成長表現相當亮眼。熟悉IC設計人士認為，現在僅有部分應用有明顯出貨下滑，以大範圍來看，客戶對DDI產品的整體備貨動能，在第1季還沒有明顯下修，隨著市場的不確定性持續增加，第2季會較具挑戰性。
8,聯發科AP封測策略多元化 力成奪2022新品訂單儘管第2季中國內需市場及總體經濟充斥不確定性，手機AP大廠聯發科持續尋求後段委外封測(OSAT)多元供應商，IC封測業界傳出，近年來積極擴展中高階邏輯IC的記憶體封測大廠力成，將分食聯發科2022年手機AP封測訂單。
9,傳Haesung Optics將打入三星供應鏈 生產OIS致動器零件傳南韓光學鏡頭零件業者Haesung Optics，將供應三星電子(Samsung Electronics)手機相機模組光學防手震(OIS)零件。Haesung Optics長期以來以三星電機(Semco)為主要客戶，近期試圖推動客戶多元化，預期將以供應三星電子OIS為目標。
10,傳超微新Ryzen處理器將投產 迎戰英特爾Raptor Lake超微(AMD)與英特爾(Intel)在處理器市場中的競爭持續加劇。隨著英特爾日前表示，採Intel 7製程與混合架構設計，代號為Raptor Lake的第13代Core系列PC處理器將於2022年下半推出，傳言透露，超微採Zen4微架構與台積電5奈米製程，代號為Raphael的新款Ryzen 7000系列DT處理器即將進入量產，並有望在2022年第3季推出。
11,半導體成長前景樂觀 供應鏈與通膨成不確定因素
13,物流比生產難掌握 PCB廠緊盯生產聚落動態中國疫情再起，配合動態疫情防控作為，7日昆山宣布封城再延長至12日，昆山作為PCB供應鏈重要的生產聚落，封城是否能如期結束，是產業界目前最受矚目的議題之一。
14,高庫存策略價值再現 封裝材料2Q拉貨重啟近期中國封城政策加上消費電子內需市場似乎有些乏力，使得半導體供應鏈充斥不確定性。封裝材料業者表示，目前昆山、上海等4月嚴格的防疫措施，確實可能使得訂單遞延，不過中長期來看也沒有太明顯的「取消」訂單情事。
15,中國封城不確定性高 物流不順恐遞延IC需求中國經濟命脈長三角及珠三角等城市，近日陸續啟動封城措施，讓逐步恢復正常的供應鏈再次陷入混亂，也對中國總體經濟帶來衝擊。台系IC設計業者雖然對中國市場仰賴程度偏低，但生產端並沒有受到太大影響，擔心物流端的混亂是否會衝擊實體需求及客戶備貨。以現狀來看，無論解封的時間是早是晚，已經確定會影響到第2季營運狀況，差別只在於訂單是短期遞延，還是長期需求衰退。
16,英特爾CEO訪印 美半導體地緣布局新篇章英特爾(Intel)執行長Pat Gelsinger近日出訪亞洲幾個國家，印度行成為一大重點，印度總理Narendra Modi在4月7日更親自會見Gelsinger。外界關注英特爾是否可能在未來參與印度政府2021年12月中宣布的Semicon India Program半導體和顯示器製造生態系統開發計畫，在印度建立本土半導體供應鏈、減少對海外晶片進口依賴等項目。
17,設備交期長、物流成本高 2023方有望緩解半導體產業進入需求高峰期，晶圓代工業者數度調高報價也趕不跑客人，至今仍處於供不應求的狀態。不過疫情帶來的缺料、缺工問題已波及到設備商，造成交期嚴重拉長。此外，海運貨櫃及航空艙位不足也造成運價飆漲，這些成本勢必要轉嫁給客戶。相關機構表示，隨著高費率被納入更長期限的航運合約中，高成本的運輸狀況可能會持續到2023年之後。
18,車規與商用爭搶產能 工業半導體委屈無人問？5G、AIoT、新能源車等新興產業崛起，汽車、消費性IC半導體之爭中，被視為「夾心餅」的工業IC，面臨供需缺口逐步拉大，恐將衝擊5G帶動工業伺服器、AIoT等建置進度。
19,晶片缺過頭  設備領域傳次級品流通由於晶片持續短缺，傳出部分通路商回收舊晶片因應新產品需求，這類「以次充好」策略其實在2021年即有傳聞，不過屬於單價不高的3C產品，但2022年受到工業用IC持續短缺衝擊，部分應用領域設備業者也開始有類似方案。
20,聯陽看好人機介面SoC 惟須留意大環境負面因素控制IC設計業者聯陽對2022年營運展望提出看法，總經理林弘堯指出，2022年主力產品EI IO晶片希望可以透過Chromebook高市佔率帶動下，維持在與2021年相當的出貨規模，而高速傳輸產品部分，優先尋求守住2021年的既有成果，成長看點可能會落在人機介面SoC以及電子紙驅動IC、工控MCU等產品線。
21,Wi-Fi 7、毫米波晶片初試啼聲 檢測分析業者先受惠隨高通(Qualcomm)、聯發科、博通(Broadcom)、英特爾(Intel)持續進行無線通訊技術升級，Wi-Fi 7布局已是箭在弦上，研發案件陸續釋出，至於5G毫米波(mmWave)晶片目前以高通領先，近期聯發科進度也急起直追。
22,NVIDIA稱可克服GPU叢集擴展性問題大型網路公司使用的Transformer模型，規模愈來愈大，且不斷成長，想要縮短訓練大型深度學習模型的時間，常用做法是增加GPU數量，然而，隨著資料中心中GPU數量的增加，效能提升效果卻開始減少。
23,BrainChip攜手SiFive 提供邊緣AI運算解決方案全球首家超低功耗神經形態AI晶片IP製造商BrainChip，與RISC-V晶片設計廠商SiFive合作，結合雙方技術為晶片設計人員提供優化的邊緣運算AI及機器學習。
24,Synopsys與Juniper Networks聯手成立新公司進軍矽光子市場新思科技(Synopsys)與Juniper Networks宣布合夥成立新公司，並以Synopsys為主要控股股東。Synopsys表示新公司提供的開放矽光子平台與光子元件，可望重塑整個光學運算產業，協助企業以更高的成本效益投入矽光子整合，加速光子IC設計的發展。
25,汽車產業已成SiC功率元件主要成長動能在汽車產業，尤其是電動車(EV)主逆變器應用需求推動下，2021年全球碳化矽(SiC)功率元件市場規模年增57%，達10.90億美元。預估2027年該市場規模還會成長至62.97億美元，合計2021～2027年市場規模年複合成長率(CAGR)為34%。
26,愛德華先進科技總經理林偉：國際大廠列採購指標 全球供應鏈減碳加速氣候變遷與節能減碳並非新議題，但近年多國各產業全動了起來，並列下積極目標，除環境永續對人類存續至關重要外，經濟因素也是推動這波ESG永續浪潮的關鍵之一。
27,載板三雄1Q22營運穩健 ABF載板成最佳護城河台系IC載板三雄第1季完整營收陸續出爐，在ABF載板需求穩定長約護體的情況下，三家公司的營收規模都穩定地向上成長。由於ABF載板出貨狀況與景氣波動沒有牽連，可以預期未來這段時間，新產能持續開出的效應，將帶動IC載板業者繼續成長，獲利表現也會穩定提升。
28,工控、車用需求強，IC 設計 Q2 營運有撐？受到中國疫情蔓延、封城等影響之下，使得消費性電子產品需求逆風延續到第 2 季，使晶片設計廠商神經緊繃，但短期大多未出現砍單現象，主要是由於工控、車用、伺服器、商用筆電需求續強。 
29,跟進蘋果策略？特斯拉新車不附旅充，得自掏腰包以往特斯拉（Tesla）電動車隨附一組旅行用充電座（Mobile Connector），可連接一般家用插座進行充電。不過，特斯拉執行長馬斯克（Elon Musk）證實，未來旅充不再是標準配備，跟進蘋果（Apple）以環保為由不提供充電器的潮流，消費者得自掏腰包另外購買。 
30,加速企業無痛數位轉型！行動貝果助百家企業導入「No-Code AI」專精 AI/ML、資料科學領域的行動貝果（MoBagel）共同創辦人暨執行長鍾哲民近日指出，新冠疫情改變環境的常態，帶來新經濟模式，大量的數位化資料讓 AI 擁有快速成長的舞台，並加速推動全球企業 ESG 永續發展，尤其在 No-Code AI（無程式碼平台）的驅動，有更精準的預測。
31,蘇州防疫升級，台封測廠謹慎以對繼中國上海、昆山後，經濟強市、外貿重鎮蘇州無預警宣布將實施封閉管控，由於該地為台商匯集之地，包括聯電、力成等晶圓代工、封測大廠在當地皆有設廠，引發外界關注。 
32,Gogole 新機 Pixel 6a 多個型號現身 FCC 網站，跑分略勝 Pixel 6Google 旗下 Pixel 6、Pixel 6 Pro 在去年 10 月發表，而可望延續 Pixel 6 部分規格的 Google Pixel a 系列新機──Pixel 6a，預期將在今年中旬發表，據悉 Pixel 6a 代表的裝置型號出現在美國聯邦通訊委員會（Federal Communications Commission，FCC）網站上。不只如此，Geekbench 資料庫也出現 Pixel 6a 與 Pixel 6 的跑分比較，Pixel 6a 在單核與多核分數上略勝 Pixel 6。
33,中國公布 666 家復工企業白名單，員工對近期恢復上班難抱期待中國疫情逐漸擴散，繼先前上海、崑山，還有華中地區的西安、鄭州進入封閉式管理之後，長三角地區另一個台商企業的投資重鎮──蘇州也在 16 日清晨無預警的宣佈升級防控，這不但使得中國經濟面臨嚴峻挑戰，也使得台商面臨整個供應鏈的生產瓶頸。對此，17 日晚間上海市經信委發布 「上海市工業企業復工復產疫情防控指引（第一版）」，其內容為保障有力有序及有效推動企業復工復產，保障產業供應鏈安全穩定。
34,廖老大「打龜號」衝速，台灣汽車改裝件拚出新商機廖老大「打龜號」以 8.72 秒拚贏中國網紅杰爺，秀台灣改裝賽車實力。不僅避震器和輪圈，台灣廠商在煞車、卡鉗、外觀件等改裝件展現深厚技術，業者盼台灣進一步開放改裝件市場、放寬使用限制，協助產業擴展全球市場。 
35,一人狂買多張防疫險？金管會：業者核保應納考量防疫保單再掀民眾搶投保之亂，有民眾一人投保 2、3 張甚至高達 5 張防疫險，金管會保險局長施瓊華表示，業者核保上應將此納入考量，依公司自身核保政策評估是否承保。 
36,「不可能」復原的魔術方塊：你看到的不是你看到的你玩過魔術方塊嗎？匈牙利建築學教授 Ernő Rubik 發明三階魔術方塊後，這益智玩具幾十年間風靡全球，且歷久不衰。不僅三階魔術方塊，更出現四階、五階、六階等高階魔術方塊，以及金字塔魔術方塊、斜轉魔術方塊、鑽石魔術方塊等各類異形。 
37,受限隱私，蘋果可能三年前就放棄讓 Siri 幫你購物你可能聽說過，國外用戶可以透過亞馬遜（Amazon）的語音助理 Alexa，以口頭交代的方式就可以在亞馬遜的電商平台中購物。但其實這樣的想法蘋果先前也想過，只是最終因為隱私性的問題，因此蘋果不得不放棄這樣的想法。
38,"連賈伯斯都覺得很酷的音效，是蘋果前維修人員做的Apple Music 雖是串流媒體音樂領域巨頭，擁有獨家專輯和超過 9,000 萬首音樂的龐大曲庫，截至 2021 年用戶量超過 9,800 萬（外媒據市占比的估算值，非蘋果官方數字），美國地區訂閱用戶量甚至超過 Spotify。 "
39,解決科技人才荒！GOLF 聯盟「學分合作」完成 400 位學生培訓由仁寶電腦、緯創資通、友達光電共同發起的「GOLF （Gap of Learning & Field）學用接軌聯盟」，為提升學生銜接職場的戰力值，GOLF 聯盟集結企業會員在上個月推出近 50 堂「接軌產業」實戰教學課程，並推出職場相關軟實力課程，至今已有近 400 位同學完訓。
40,蘋果「尋找」App 小麻煩，八成 AirPods 無法整新售出蘋果 iOS 15 作業系統將 AirPods 整合至「尋找」App 搜尋，用戶如果不小心弄丟耳機有機會透過「尋找」找回，只不過這美意現在卻成為零售商的小麻煩。外媒報導，如果消費者買 AirPods 後退貨，但消費者已將耳機與 Apple ID 連結且忘了與 Apple ID 解除配對，零售商幾乎無法整新耳機再賣出。
41,分析師：殖利率觸及重要趨勢線，40 年債券牛市承壓知名技術分析師指出，美國 10 年期公債殖利率測試「史上最重要的趨勢線」，若是成功突破，美國 40 年來的低利率可能會劃上句點，這不利美股。但是要是殖利率受阻下挫，低利率可望持續，有助股市回春。 
42,插腳可收折、雙 USB-C 孔，蘋果 35W 快充頭外觀曝光先前消息指出，蘋果正在開發 35W 雙 USB-C 充電頭，需要時可為兩部設備充電。現在有 Twitter 帳號爆料新充電頭外觀。
43,在架上夠久了，傳 iPhone 11 今年下半年停產提到目前架上的平價 iPhone，多數人可能會直覺想到最新推出的 iPhone SE 3，但其實如果是想以平易近人價格入手全螢幕 iPhone 的用戶，也可以選擇 iPhone 11。iPhone 11 在蘋果官網架上販賣算是相當長的一段時間，但是可能會隨著今年下半年 iPhone 14 系列的推出，大家就要跟 iPhone 11 說聲再見了。
44,小資族、股市大戶股利所得，聰明繳稅「眉角」報你知去年上市櫃企業成長動能強勁，當年度獲得豐沛股利的股東，與公司共享成長果實，隨著 5 月報稅季將至，小資族、股市大戶該如何聰明報稅，透過情境試算，3 大關鍵整理一次解析。
45,Lenovo 平板新機在台上市，預告首款 5G 平板即將登場聯想（Lenovo）7 日公布 3 款平板新品的在台上市資訊，包括 12.6 吋大螢幕輕薄平板 Tab P12 Pro、內建 0~180 度支架支援多種使用模式的 Yoga Tab 11，以及聯想在台推出的首款 5G 平板 Tab P11 5G，針對不同使用需求，為消費者解鎖絕佳生產力以及升級娛樂體驗。
46,中證監：滴滴啟動美股下市，無礙中美審計合作據 TechWeb 17 日報導，中國叫車服務平台滴滴於 16 日發布公告表示，將於今年 5 月 23 日晚上 7 點舉行特別股東大會，就公司的美國存託股票自紐約證交所自願退市進行投票，在退市完成前，公司將不會申請其股份在其他任何證券交易所上市。 
47,Switch 3 月日本銷量續縮不到 40 萬台，PS5 飆四成任天堂（Nintendo）Switch 系列機種（一般版 Switch＋Switch Lite＋OLED 版Switch）3 月雖持續稱霸日本遊戲機市場，不過銷售量續縮，月銷售量連 2 個月不到 40 萬台水準，Sony PS5 系列機種（搭載光碟機標準版＋未搭載光碟機數位版）銷量飆增四成。 
48,"廣達上海廠局部復工，約 5% 員工上班廣達 13 日宣布，上海廠為配合當地疫情防控停工，分析指 MacBook 生產大受衝擊。中共官媒新華社報導，擁有 4 萬餘名員工的廣達，15 日已有約 2,000 名員工率先復工。"
49,概念近似 Switch？蘋果獲遊戲控制器新專利蘋果自從推出雲遊戲平台 Apple Arcade 後，便逐步地擴增其遊戲內容，試圖在遊戲市場中占有一席之地。而根據美國專利商標局與歐洲專利局最新釋出的蘋果專利文件顯示，該公司有計劃推出專屬於自家的遊戲控制器，乍看之下概念有點近似於任天堂的 Switch。
51,支援文件曝光新品，傳蘋果推 35W 雙孔 USB-C 充電器蘋果未來很可能發表原廠新款的 USB-C 充電器，帶來顯著的效能提升。國外媒體 9to5Mac 曾在蘋果網站上短暫看過一份支援文件，顯示該公司正在開發一款新的 35W 雙孔 USB-C 電源轉接器。
52,上海公布復工名單，台積電：松江廠沒停工中國上海本土 COVID-19 疫情嚴峻衝擊當地企業運作，中國媒體今天報導，上海 666 家重點企業復工復產白名單曝光，台積電松江廠列位其中。台積電今天晚間表示，松江廠原本就沒有停工，現在也是一樣。
53,別跟 Fed 作對，霸榮：5 月賣、快走開，生技股可避險美國投資界有句諺語，叫「Sell in May and go away 」（5 月賣、快走開），這對今年面臨聯準會（Fed）緊縮抗通膨、俄烏開戰、通膨居高不下、疫情揮之不去的美股來說，或許是最佳策略。 
54,特斯拉全自駕測試用戶已達十萬人，馬斯克再次喊話今年將有大進步特斯拉全自動駕駛測試版用戶，在今年初還只有 6 萬人，但馬斯克在最新的訪談中表示，目前參與 FSD Beta 計畫車主已經多達十萬人，但對於何時能夠實現真正的全自動駕駛，馬斯克這次倒是講得很保守。 
55,停工 3 週產量損失 5 萬輛，傳特斯拉上海廠 4/18 復工中國政府堅持執行「動態清零」，經濟重鎮上海封城超過 20 天，造成製造業嚴重停擺，特斯拉（Tesla）上海超級工廠也無法倖免。不過，外媒消息指出，特斯拉規劃於週一（18 日）重啟上海廠運作，並獲得當地政府核准。
56,良率待克服！三星延後 89 吋 Micro LED 電視生產計畫三星今年計劃推出 89 吋、101 吋及114 吋共 3 款 Micro LED 電視，前兩款原計劃 5 月投產，但韓媒 TheElec 獲悉，三星已延遲 89 吋 Micro LED 電視的生產，101 吋則尚未決定生產時間。 
57,37 年後發現的 Windows 1.0 彩蛋，原來還有他有一群熱愛「挖掘」網路的人，想找的不是病毒，而是彩蛋。源自西方復活節找彩蛋遊戲誕生的「彩蛋」（Easter egg），如今演變成多種形式，在電影、電視劇、電腦程式或遊戲到處可見。 
58,俄烏戰爭與高通膨影響擴大，2022 年電視、液晶監視器、筆電出貨面臨修正壓力俄烏戰爭直接影響東歐乃至整個歐洲市場，導致原物料供給不穩，價格持續上漲，加劇通膨惡化，全球經濟遭受重擊，此外近期中國疫情擴大，受清零強勢政策影響，封城停工恐導致工廠生產效能降載及物流延宕受阻等複雜問題。TrendForce 表示，全球政經局勢不確定性將衝擊電視、液晶監視器、筆電等三大顯示器應用需求，2022 上半年將壟罩在修正壓力下。 
59,MWC 2022 聚焦連接效益，物聯網平台再成顯學MWC 2022 以連接效益為展會主軸，活動內容聚焦 5G、AI、金融科技等六大主題。觀察物聯網發展態勢，萬物連網趨勢帶出設備部署簡化與數據管理效率等挑戰，使物聯網平台成各方搶占市場與發展產品服務的關鍵之一，2023 年全球市場規模上看 130 億美元。 
60,月球近遠地端之間的異常，與巨大撞擊有關月球面對地球這面和背面，兩者地形特徵看起來大不相同。月球近地端有較多月海（寬廣、暗黑色的古代熔岩流遺跡），充滿隕石坑的遠地端幾乎沒有大規模月海特徵。為什麼月球兩半地表如此不同，是月球長久以來的謎團。 
61,郭明錤：Apple Car 團隊解散，半年內得重組蘋果 Apple Car 計畫一直受外界關注，雖然一直沒有明確表示有這計畫，傳言還是滿天飛。但中資天風證券知名分析師郭明錤指出，Apple Car 團隊已解散一段時間，但為了 2025 年推出 Apple Car，蘋果得在 3~6 個月內重組團隊。
62,核准莫德納疫苗用於 6 至 11 歲，半劑量間隔 28 天打 2 針COVID-19 本土單日新增確診飆破千例，已有首例幼兒重症，衛福部食藥署 17 日通過授權莫德納疫苗適用於 6 至 11 歲兒童，劑量為成人的一半，完整接種為施打 2 劑、間隔 28 天。
63,億萬富翁不足以形容，馬斯克將成為史上第一個資產破兆的人馬斯克很可能要超越億萬富翁等級，成為史上第一個資產超過 1 兆美元的人，分析機構預估最快 2024 年，馬斯克就會成為歷史最多資產的人。 
64,中國封城最糟情況：最慘 1 千萬支 iPhone 生產受影響中國新冠肺炎（COVID-19）疫情延燒，上海等多地封城，而據分析師表示，中國持續封城的話，將對蘋果（Apple）部分產品以及 Dell、聯想（Lenovo）筆電產品出貨造成影響，其中在最糟的情況下，最慘恐千萬支 iPhone 生產受影響。
65,全球電視面板市場發展動態2022 年大世代線全球顯示產能隨著韓系面板廠 OLED 產能持續放量、LCD 生產的延長，以及其他地區面板廠部分 LCD 產線最大產能仍在注入市場，因此預期整體電視面板供給量能將大幅躍升。 
66,Steam Deck 添生力軍，將支援微軟 Xbox Live Gaming眾多玩家期盼已久的 Steam Deck 正式上市後，很快拿來與占據掌上遊戲機市場的 Nintendo Switch 相提並論，遊戲數量方面，近日微軟公布將以 Edge 為基礎，讓 Xbox Live Gaming 支援 Steam Deck。
67,10.3 吋閱讀器 mooInk Pro 2 展開早鳥預購，4 月下旬出貨讀者以及閱讀器愛用者久等了，Readmoo 讀墨電子書宣布新一代電子紙平板 10.3 吋 mooInk Pro 2，將在 3 月 29 日中午 12 點啟動預購，並於 4 月下旬後陸續出貨。
68,串流主流戰爭：奧斯卡獎票房影響力衰退，串流是侵蝕還是保障電影收入？如果《樂動心旋律》（CODA）是在 3 年前拍出上架，那它很可能不會成為奧斯卡殿堂的最佳影片。在那時候，好萊塢的大老們還在阻擋串流影音的趨勢，當權派認為「大螢幕播放是電影體驗的一部分」，而在串流大發利市的時候，他們認為 Netflix 只能是一種「電視電影」，串流只能夠競爭艾美獎、但不能競爭奧斯卡獎。
69,NASA 與微軟合作 AI 檢測系統，檢查太空手套關鍵問題許多與太空有關的電影，如果太空人遇到危險，有不小機率是太空衣破損。如《星際效應》Cooper 頭盔就被 Mann 博士砸出裂痕。
70,保時捷打造全球唯一實體化閃電麥坤女友 Sally，拍賣所得全數做公益保時捷宣佈將皮克斯動畫電影《汽車總動員》女主角 Sally 實體化，這輛獨一無二的 911 Carrera 將送往蘇富比拍賣，所得全數捐贈給烏克蘭難民，以及需要幫助的年輕女孩。 
71,與郭明錤意見分歧，Ross Young：蘋果 6 月將推 27 吋 Mini LED 產品中資天風國際證券分析師郭明錤 16 日表示，礙於成本考量，今年不會推出任何 Mini LED 新品，不過調研機構 DSCC 執行長 Ross Young 隔一天在 Twitter 認為，相信蘋果 6 月推出採用 Mini LED 的 27 吋顯示螢幕。 
72,伊萊克斯軟體更新錯誤，微波爐現在以為自己是蒸烤爐約兩週前，知名家電廠商伊萊克斯旗下品牌 AEG 釋出微波爐產品軟體更新，但不幸的是，這次軟體更新出現錯誤，因此讓荷比盧地區 AEG KMK968000T 微波爐無法正常運作，確切原因竟然是軟體更新後 AEG KMK968000T 微波爐「質疑」自己的身分，認為自己是蒸烤爐。
73,想當人體信用卡？英國公司幫你植入微晶片，從此嗶手不嗶卡以前結帳用現金或刷卡，近年則流行用手機支付，未來世代或許不用再攜帶任何工具，只要舉起手刷一下，就能輕鬆完成付款。 
